<?xml version="1.0" encoding="UTF-8"?>
<todoManagerData xmlns:xsi="http://www.w3.org/2001/XMLSchema-instance" xsi:noNamespaceSchemaLocation="todoManagerData.xsd">
  <tasks>
    <task>
      <name>Task1</name>
      <date>2013-01-24T22:30:00.000+01:00</date>
      <priority>LOW</priority>
      <completed>false</completed>
      <category>Sport</category>
      <description />
    </task>
    <task>
      <name>Task2</name>
      <date>2013-01-26T12:30:00.000+01:00</date>
      <priority>HIGH</priority>
      <completed>true</completed>
      <category>jshkshkf</category>
      <description />
    </task>
    <task>
      <name>ciao</name>
      <date>2013-01-27T12:30:00.000+01:00</date>
      <priority>HIGH</priority>
      <completed>false</completed>
      <category>Sport</category>
      <description>this is new!</description>
    </task>
    <task>
      <name>Task0</name>
      <date>2013-01-27T12:30:00.000+01:00</date>
      <priority>HIGH</priority>
      <completed>false</completed>
      <category>fun</category>
      <description />
    </task>
    <task>
      <name>New task!</name>
      <date>2013-01-31T17:45:00.000+01:00</date>
      <priority>HIGH</priority>
      <completed>false</completed>
      <category>meeting</category>
      <description>some brief text.</description>
    </task>
    <task>
      <name>aaaaa</name>
      <date>2013-02-22T12:43:06.797+01:00</date>
      <priority>NORMAL</priority>
      <completed>false</completed>
      <category>kfjsdkfs</category>
      <description>bla bla bla a description</description>
    </task>
  </tasks>
  <categories>
    <category>
      <name>kfjsdkfs</name>
      <color>-11867345</color>
    </category>
    <category>
      <name>meeting</name>
      <color>-7283286</color>
    </category>
    <category>
      <name>jshkshkf</name>
      <color>-4000695</color>
    </category>
    <category>
      <name>Sport</name>
      <color>-14752099</color>
    </category>
    <category>
      <name>fun</name>
      <color>-9916485</color>
    </category>
    <category>
      <name>Prova</name>
      <color>-1104603</color>
    </category>
  </categories>
</todoManagerData>
