<?xml version="1.0" encoding="UTF-8"?>
<todoManagerData xmlns:xsi="http://www.w3.org/2001/XMLSchema-instance" xsi:noNamespaceSchemaLocation="todoManagerData.xsd">
  <tasks>
    <task>
      <name>ciao</name>
      <date>2013-01-27T12:30:00.000+01:00</date>
      <priority>HIGH</priority>
      <completed>true</completed>
      <category>Sport</category>
      <description>this is new!</description>
      <urgent>false</urgent>
    </task>
    <task>
      <name>A good name!</name>
      <date>2013-01-31T17:45:00.000+01:00</date>
      <priority>LOW</priority>
      <completed>false</completed>
      <category>Test</category>
      <description>some brief text.sfksfskfjskfskdfsdkfjskdhfskdskdfskjfdsklfjskdljfksdljflsdkjlsdjfsdljfsdlfjsdljsdlfjdslfjsdlfjsdljfsldjdlsjflsdkjfldsjfldsjfldsjfdkls</description>
      <urgent>false</urgent>
    </task>
    <task>
      <name>Hi 3</name>
      <date>2013-02-20T12:30:00.000+01:00</date>
      <priority>NORMAL</priority>
      <completed>false</completed>
      <category>Meeting</category>
      <description>this is new!</description>
      <urgent>false</urgent>
    </task>
    <task>
      <name>Hi2</name>
      <date>2013-02-21T12:30:00.000+01:00</date>
      <priority>HIGH</priority>
      <completed>true</completed>
      <category>Fun</category>
      <description>this is new!</description>
      <urgent>true</urgent>
    </task>
    <task>
      <name>H4i</name>
      <date>2013-02-23T12:30:00.000+01:00</date>
      <priority>HIGH</priority>
      <completed>false</completed>
      <category>Sport</category>
      <description>this is new!</description>
      <urgent>false</urgent>
    </task>
    <task>
      <name>Hi</name>
      <date>2013-02-27T12:30:00.000+01:00</date>
      <priority>HIGH</priority>
      <completed>false</completed>
      <category>Fun</category>
      <description>this is new!</description>
      <urgent>false</urgent>
    </task>
    <task>
      <name>Hi</name>
      <date>2013-02-27T12:30:00.000+01:00</date>
      <priority>LOW</priority>
      <completed>false</completed>
      <category>Fun</category>
      <description>this is new!</description>
      <urgent>true</urgent>
    </task>
  </tasks>
  <categories>
    <category>
      <name>Fun</name>
      <color>-9916485</color>
    </category>
    <category>
      <name>Test</name>
      <color>-1104603</color>
    </category>
    <category>
      <name>Meeting</name>
      <color>-7283286</color>
    </category>
    <category>
      <name>Sport</name>
      <color>-14752099</color>
    </category>
  </categories>
</todoManagerData>
